{
  "$schema": "http://json-schema.org/draft-07/schema#",
  "$id": "https://osf-schemas/validation/consumer-schema.json",
  "title": "Consumer",
  "description": "Meta-schema for consumers/*.json (NOT consumers/waivers/). Declares a UNS consumer (edge / middleware / gateway / script) with its stage, ring and feedback contract. A CARRIER lists the sources it carries (carries, exclusive: a source has one carrier or one waiver) and its capacity. A READER lists what it reads of the model (reads: no coverage duty, never exclusive, not counted against capacity) and must declare feedback, because a reader is in the model only to report what it has loaded. A consumer may be both (Block B, 24.09.).",
  "type": "object",
  "required": ["consumerId", "version", "kind", "stage", "ring", "authoring"],
  "anyOf": [
    { "required": ["carries", "capacity"] },
    { "required": ["reads", "feedback"] }
  ],
  "properties": {
    "consumerId": { "type": "string", "pattern": "^[a-z0-9][a-z0-9-]*$" },
    "version": { "type": "string", "pattern": "^[0-9]+\\.[0-9]+\\.[0-9]+(-[0-9A-Za-z.-]+)?(\\+[0-9A-Za-z.-]+)?$" },
    "kind": { "type": "string", "enum": ["edge", "middleware", "gateway", "script"] },
    "stage": { "type": "string", "enum": ["push", "pull", "export", "manual"] },
    "ring": { "type": "integer", "minimum": 0 },
    "carries": {
      "type": "array",
      "minItems": 1,
      "uniqueItems": true,
      "items": { "type": "string", "minLength": 1 }
    },
    "reads": {
      "description": "Paths of the model this consumer reads, relative to the tree root: a class directory ending in / (profiles/), a subdirectory (sources/opcua/) or one file (sources/it/x.json). Each path must exist in the tree.",
      "type": "array",
      "minItems": 1,
      "uniqueItems": true,
      "items": { "type": "string", "pattern": "^[a-z0-9][a-z0-9-]*(/[A-Za-z0-9][A-Za-z0-9._-]*)*/?$" }
    },
    "capacity": { "type": "integer", "minimum": 1 },
    "authoring": { "type": "string", "enum": ["locked", "open"] },
    "description": { "type": "string" },
    "feedback": {
      "type": "object",
      "required": ["grains", "maxAgeSeconds"],
      "properties": {
        "grains": {
          "type": "array",
          "minItems": 1,
          "uniqueItems": true,
          "items": { "type": "string", "enum": ["loaded", "seen"] }
        },
        "maxAgeSeconds": { "type": "integer", "minimum": 1, "maximum": 86400 }
      },
      "additionalProperties": false
    }
  },
  "patternProperties": {
    "^\\$": { "type": "string" }
  },
  "additionalProperties": false
}
