{
  "consumerId": "it-erp-sap",
  "version": "1.0.0",
  "kind": "edge",
  "stage": "push",
  "ring": 0,
  "carries": [
    "erp-production-orders",
    "erp-operations-response",
    "erp-bde-confirmations",
    "sim-v5-erp-articles",
    "sim-v5-erp-customers",
    "sim-v5-erp-calendar"
  ],
  "capacity": 75,
  "authoring": "locked",
  "description": "IT edge for the ERP REST sources (it-edge, no flow editor). Capacity = signal count today, measured 23.09."
}
