{
  "consumerId": "edge-cnc-001",
  "version": "1.0.0",
  "kind": "edge",
  "stage": "push",
  "ring": 0,
  "carries": [
    "opcua-cnc-001-telemetry",
    "opcua-cnc-001-event"
  ],
  "capacity": 19,
  "authoring": "open",
  "description": "OT edge of cnc-001 (edge-runtime + Node-RED). Capacity = signal count carried today, measured 23.09.; no declared limit yet."
}
