{
  "consumerId": "edge-rockwell-01",
  "version": "1.0.0",
  "kind": "edge",
  "stage": "push",
  "ring": 0,
  "carries": [
    "opcua-rockwell-01-telemetry",
    "opcua-rockwell-01-event"
  ],
  "capacity": 19,
  "authoring": "open",
  "description": "OT edge of rockwell-01 (edge-runtime + Node-RED). Capacity = signal count carried today, measured 23.09.; no declared limit yet."
}
